{
  "$schema": "https://json-schema.org/draft/2020-12/schema",
  "$id": "https://hivemind.local/schemas/v0/relation.added.json",
  "title": "relation.added event",
  "type": "object",
  "additionalProperties": false,
  "required": ["event_uuid", "type", "actor_id", "source", "payload"],
  "properties": {
    "event_id": { "type": ["integer", "null"], "minimum": 1 },
    "event_uuid": { "type": "string", "format": "uuid" },
    "correlation_id": { "type": ["string", "null"], "minLength": 1 },
    "causation_event_id": { "type": ["integer", "null"], "minimum": 1 },
    "type": { "const": "relation.added" },
    "actor_id": { "type": "string", "minLength": 1 },
    "source": { "enum": ["cli", "agent", "human", "slack", "document", "api"] },
    "source_ref": { "type": ["string", "null"], "minLength": 1 },
    "ts": { "type": ["string", "null"], "format": "date-time" },
    "payload": {
      "type": "object",
      "additionalProperties": false,
      "required": ["relation", "from_id", "to_id"],
      "properties": {
        "relation": {
          "$comment": "ASSUMES is the canonical wire value; PREMISED_ON is the accepted human-readable alias (serialised as ASSUMES in the ledger). FOLLOWS_FROM links a decision to a prior decision it follows from (a premise in the broad sense), distinct from BASED_ON/ASSUMES (a claim about the world) and from decision.superseded (the parent still stands).",
          "enum": ["BASED_ON", "HAS_OPTION", "CHOSE", "ASSUMES", "PREMISED_ON", "SUPPORTS", "REFUTES", "FOLLOWS_FROM"]
        },
        "from_id": { "type": "string", "minLength": 1 },
        "to_id": { "type": "string", "minLength": 1 }
      }
    }
  }
}
