{
  "event_id": 7,
  "event_uuid": "018f5d8a-03fb-7df0-8e36-64d7410cfe17",
  "correlation_id": "session-1",
  "causation_event_id": 5,
  "type": "relation.added",
  "actor_id": "agent-a",
  "source": "agent",
  "source_ref": "agent:codex:session-1",
  "payload": {
    "relation": "FOLLOWS_FROM",
    "from_id": "decision-keep-embedded-db",
    "to_id": "decision-slice-1-scope"
  },
  "ts": "2026-05-17T20:46:43Z"
}
